id, content
8, 人们表达对其他人的感激之情，有一种方式就是创造一些美好的东西。在你精心制作这个东西的过程中，你会把爱包含在里面，不知不觉传递出去。
7, 我经常看到人们不断寻找最好的笔记 App、最好的 Linux 发行版、提高生产力的最佳 AI 软件、最好的游戏引擎……这样做并不会提高你的效率，你永远找不到最好或最完美的设置。我的建议是，只要一样东西足够好、能完成工作，你就不妨坚持用下去。不要盯着工具，而要盯着你要完成的工作。
6, 你可以做的比你想象的更多。我们被无形的正统观念所束缚。物理定律是唯一的限制。
5, 我们知道的比我们想象的要少。复制危机（replication crisis）并非偶然。我们认为的许多事情都是错误的。我们常常甚至没有提出正确的问题。
4, 做事情快速是很重要的。因为你更频繁地与现实接触，所以每单位时间学到的东西更多。快速前进使你专注于重要的事情；没有时间废话。慢就是虚假的。一周占据一年的2%。时间是决定因素。
3, 热情是很重要的！对你而言，从事令人兴奋的事情要容易得多。因此，做大事可能比做小事更容易。能量是进步的必要输入。
2, 作为人类，重新塑造宇宙以符合我们的偏好是我们的权利（也许是我们的道德责任）：真正的知识——技术使这成为可能；你应该努力提高天花板，而不是地板。
1, 野心很脆弱，容易被各种困难摧毁
